{
  "schemaVersion": "1.2",
  "identity": {
    "expertName": "Анастасия",
    "niche": "Наставник для экспертов"
  },
  "current": {
    "monthlyRevenueRub": 200000,
    "monthlyRevenueContext": null,
    "payingClientsCount": 10,
    "clientsCountPeriod": "month",
    "weeklyHours": 50,
    "products": "У меня есть наставничество за 308 тысяч. Это личное сопровождение. Есть еще тариф с продюсером, где мы все делаем за эксперта за 500, но мы пока еще его не начали продавать. Пока только ввели.\n\nЕсть еще тариф с маркетологом, где воронку эксперт собирает под присмотром маркетолога за 148 тысяч. Его тоже покупают, но его пока еще не разу покупали раньше. Он стоил 88 800. Вот когда он стоил 88 800, его просто разбирали, как горячие пирожки. Очень часто покупали.\n\nСейчас мы подняли стоимость, потому что посчитали, что за 88 800 это вообще не рентабельно. Очень много времени тратим на клиента и ничего не зарабатываем практически. После поднятия стоимости вы перестали покупать. Мы ввели тариф с куратором. Это тариф самостоятельный, плюс распаковки с куратором и обратная связь от куратора. То есть в течение месяца можно задавать свои вопросы.\n\nТариф с куратором у нас сейчас есть. Есть тариф самостоятельный за 36 800. Это команда из шести нейромаркетологов, которые помогают строить бизнес-систему. Его покупают чаще всего.\n\nИногда берут только какого-то одного нейромаркетолога из всей команды, если денег совсем мало или эксперт думает, с чего начать. Обычно он стоит 9 000. Чаще всего покупают либо сошку (а это у нас агент по распаковке уникальности), либо берут пушу для написания постов. Да, продукты связаны друг с другом.\n\nУ нас человек приходит на бесплатный разбор. С разбора ему предлагают наставничество. Если на наставничество клиент не соглашается, то даунсел у нас тариф с маркетологом либо с куратором. В крайнем случае ему предлагают взять одну команду, просто команду, без соприкосновений. Если у него нет совсем денег или он очень сильно сомневается, то ему предлагают взять только одного нейромаркетолога, причем можно в рассрочку несколько месяцев, то есть под любой кошелек получается. Сейчас я перезаписываю продукт, делаю его в записи. Наставничество в записи будет продавать дополнительные услуги маркетолога, куратора. Нам это очень выгодно.",
    "bestSeller": "Чаще всего покупают тариф «самостоятельный» за 36 800.\nСамый дорогой продукт сейчас у нас это наставничество: за 308 тысяч его покупают на конверсии, наверное, примерно 5%.",
    "freeProducts": "Да, есть Литмагнит. Это бесплатный урок. Как раз Литмагнит заводит в нашу воронку, и мы начинаем уже диалог со всеми, кто перешел смотреть на наш Литмагнит.\n\nДальше бесплатный продукт: бизнес-разбор. Мы его проводим бесплатно. Бизнес-разбор это КЭВ, то есть ключевой элемент нашей воронки. На нем мы продаем флагманы. \nТочкой входа у нас сейчас такая, что ты думаешь, что тебе нужно блок вести. На самом деле это иллюзия: нужно создавать систему, нужно строить систему.\n\nЭта точка входа: какой результат дает? Лид-магнит бесплатно приводит к инсайту, что нужно строить систему. Разбор встречи приводит к четкому пониманию, где эта система сейчас проседает, что является узким горлышком, то есть почему нет результата.\n\nЧеловек на выходе получает четкий план действий, что тебе надо сделать. Вот просто дальше он может, конечно, пойти делать это все сам, если у него есть знания, а если нет, этот план можно рисовать только с нами."
  },
  "target": {
    "monthlyRevenueRub": 800000,
    "businessModel": "Хочу сделать акцент на продажу наставничества в записи. Сделать тариф за 90 тысяч, чтобы он раскупался так же, как раскупался у нас тариф за 88 тысяч. Чтобы у нас покупали тот же продукт, но мы не тратились на сопровождение, покупали его просто в записи. На это хочу сделать акцент.",
    "deadlineMonths": 6,
    "delegation": "Сейчас у меня делегированы продажи. У меня менеджеры по продажам продают на встречах, а менеджеры по перепискам переписываются с клиентами.\n\nСейчас на мне лично это: вайп-кодинг, создание лендингов, сервисов, офферов. Я бы хотела делегировать полностью вайп-кодинг и создание воронок.\n\nНаверное, именно это меня удерживает пока что в проекте, не даёт выйти из операционки, потому что очень много здесь завязано именно мне. Мне нужен проект, который возьмёт это всё на себя и будет управлять проектом: и лендинги сам делать, и воронки сам собирать, либо находить исполнителей на этом. В общем, сам будет этим рулить.\n\nЗа собой лично хочу оставить создание новых продуктов, иногда проводить авторские встречи. Это заложено в тарифе с наставником, но их можно купить отдельно.\n\nМне очень нравится работать с командой, растить команду, в целом принимать бизнес-решения, смотреть в расширение, подключать инновационные решения. То есть я бы больше хотела оставить роль стратега.",
    "desiredSystemWeeklyHours": 28
  },
  "project": {
    "clients": "Мои клиенты: это эксперты, которые обучают, консультируют и оказывают услуги онлайн. По своей сути это:\n- психологи\n- маркетологи\n- нутрициологи\n- эзотерики\n- преподаватели\n- наставники\n- менторы\n- коучи\n- и другие помогающие и не только эксперты\nТо есть это эксперты, которые консультируют, оказывают услуги, обучают онлайн. Почему они выбирают меня?\n\nВо-первых, потому что я сама прошла этот путь: я была психологом, я была маркетологом. Сейчас я совмещаю эти роли, и я точно на несколько шагов впереди своей аудитории. У меня уже есть тот доход, к которому они стремятся.\n\nПочему они выбирают меня? Потому что у меня есть виртуозное качество: это совмещать творческое с технологичным. Я мастерски умею собирать системы, вижу просто как рентген, как пересобрать систему. Нам именно за это они платят, именно это они очень ценят. Моя способность собирать систему, при этом собирать её с душой, собирать уникальные, аутентичные системы, основанные на настоящем эксперта, поэтому они доверяют.\n\nУ меня уже тот путь, который они только хотят пройти. У меня есть результаты, к которым они стремятся. При этом я проживала все те же боли, которые они сейчас проживают. Я также с этим сталкивалась, и я нашла решение, собрала свою систему, поэтому они ко мне тянутся.\n\nС кем я точно не хочу работать? Это с эзотериками, у которых нет психологического образования. Я считаю, что эзотерики и психологи это то, что должно вытекать одно из другого, и оно не может существовать друг без друга. При этом психология это основа. Психологию нужно очень глубоко понимать.\n\nЕсли эзотерик, он только эзотерик и не понимает психологию, я с ним работать не буду, потому что для меня это отлетевшая аудитория.\n\nВторая категория, с кем я не работаю, это эксперты в детской позиции, которые не хотят брать на себя ответственность, которые считают, что за них всё должны сделать. Они прокрасившие, срывают сроки. Мы, конечно, достаточно лояльны, но тянуть никого точно не будем.\n\nЕсли на разборе мы видим, что человек очень в детской позиции, инфантильный, то мы ему будем продавать только самостоятельный тариф, и мы его не возьмем в сопровождение.\n\nКто сейчас мои клиенты? То есть это вот эти эксперты, у которых есть запрос: эксперты, которые консультируют, обучают и оказывают услуги онлайн. У них есть запрос на рост клиентов. То есть их основная проблема: то, что мало клиентов, и они хотят большое желания: это доход 300 тысяч плюс, к примеру. Вот это мои люди. Ну и кроме того, именно мои это те, кто пересекается с моими ценностями. Мои ценности: свобода, гедонизм. Если человек хочет быть свободным в этом мире, финансово, морально, он хочет выстроить свободную, независимую жизнь, в которой есть благополучие и наслаждение. То это точно мой человек.\n\nУ нас все получится. Также моя ценность: достижение цели, и мои люди: те, кто реально ставят цели и их достигает. По крайней мере, они этого очень хотят. Им просто нужны инструменты и вектор, и у них точно все получится точно так же, как когда-то получилось у меня.",
    "result": "За какой результат платят клиента? Неготовы платить за увеличение дохода? Деньги за деньги у них растет доход. Они получают работающие связки, не получают систему, которая дает деньги каждый месяц.\nК этому результату я реально привожу недавний пример: клиент пришёл с запросом на то, что нет продаж уже четыре месяца, и он на выходе получил:\n1. Мы сделали с ним запуск, и он заработал 600 тысяч.\n2. Мы выстроили с ним систему, и он теперь может зарабатывать каждый месяц 300 тысяч.\nКак я понимаю, этот результат действительно достигнут. А это мой клиент получает оплату. Да, мой продукт действительно закрывает эту задачу.\nТе, кто проходит самостоятельное обучение, в записи от них мы получаем обратную связь. Точная работа с каждым отдельным нейромаркетологом: например, после работы с soull мы часто это наш нейромаркетолог по аутентичности. Мы часто получаем обратную связь о том, что работаю soull и плачу: «Я наконец-то поняла себя, настоящая. Это как будто долгожданная встреча с собой».\nТо есть люди, которые очень глубоко эксперты, понимают свою аутентичность, находят свою уникальность, становятся более уверенными. У них пропадают страхи продаваться, страхи заявлять о себе. Только от работы с одним нейромаркетологом для меня это уже важный результат, когда клиент берёт продукт самостоятельно.",